ffff88005b5599c0 3521611323 S Ci:6:001:0 s a3 00 0000 0001 0004 4 <
ffff88005b5599c0 3521611350 C Ci:6:001:0 0 4 = 00010000
ffff88005b5599c0 3521611362 S Ci:6:001:0 s a3 00 0000 0002 0004 4 <
ffff88005b5599c0 3521611366 C Ci:6:001:0 0 4 = 00010000
ffff88007d71e600 3521611371 S Ii:6:001:1 -115:128 2 <
ffff88005b5599c0 3521690314 S Ci:5:001:0 s a3 00 0000 0001 0004 4 <
ffff88005b5599c0 3521690324 C Ci:5:001:0 0 4 = 00010000
ffff88005b5599c0 3521690331 S Ci:5:001:0 s a3 00 0000 0002 0004 4 <
ffff88005b5599c0 3521690341 C Ci:5:001:0 0 4 = 00010000
ffff88007d71e480 3521690344 S Ii:5:001:1 -115:128 2 <
ffff88005b559180 3521770324 S Ci:4:001:0 s a3 00 0000 0001 0004 4 <
ffff88005b559180 3521770338 C Ci:4:001:0 0 4 = 00010000
ffff88005b559180 3521770347 S Ci:4:001:0 s a3 00 0000 0002 0004 4 <
ffff88005b559180 3521770355 C Ci:4:001:0 0 4 = 00010000
ffff88007d71e300 3521770358 S Ii:4:001:1 -115:128 2 <
ffff88005b559000 3521850319 S Ci:3:001:0 s a3 00 0000 0001 0004 4 <
ffff88005b559000 3521850334 C Ci:3:001:0 0 4 = 00010000
ffff88005b559000 3521850343 S Ci:3:001:0 s a3 00 0000 0002 0004 4 <
ffff88005b559000 3521850349 C Ci:3:001:0 0 4 = 00010000
ffff88007d70cf00 3521850353 S Ii:3:001:1 -115:128 2 <
ffff88005b559cc0 3521930313 S Ci:2:001:0 s a3 00 0000 0001 0004 4 <
ffff88005b559cc0 3521930323 C Ci:2:001:0 0 4 = 00010000
ffff88005b559cc0 3521930329 S Ci:2:001:0 s a3 00 0000 0002 0004 4 <
ffff88005b559cc0 3521930339 C Ci:2:001:0 0 4 = 00010000
ffff88007d70cb40 3521930343 S Ii:2:001:1 -115:128 2 <
ffff88006249e480 3521930985 S Co:1:083:0 s 40 a0 e600 0000 0001 1 = 01
ffff88006249e480 3521931156 C Co:1:083:0 0 1 >
ffff88006249e480 3521931364 S Co:1:083:0 s 40 a0 1279 0000 0010 16 = 90e600e0 ffef54e7 ffef4410 ff90e600
ffff88006249e480 3521931526 C Co:1:083:0 0 16 >
ffff88006249e480 3521931560 S Co:1:083:0 s 40 a0 1289 0000 0003 3 = eff022
ffff88006249e480 3521931650 C Co:1:083:0 0 3 >
ffff88006249e480 3521931687 S Co:1:083:0 s 40 a0 0036 0000 000a 10 = 75b20775 80007580 0122
ffff88006249e480 3521931775 C Co:1:083:0 0 10 >
ffff88006249e480 3521931804 S Co:1:083:0 s 40 a0 0003 0000 0002 2 = 8f39
ffff88006249e480 3521931900 C Co:1:083:0 0 2 >
ffff88006249e480 3521931941 S Co:1:083:0 s 40 a0 0005 0000 0010 16 = 75800075 3a00e53a c3940850 1de53930
ffff88006249e480 3521932026 C Co:1:083:0 0 16 >
ffff88006249e480 3521932068 S Co:1:083:0 s 40 a0 0015 0000 0010 16 = e7054380 04800353 80fb4380 02e53925
ffff88006249e480 3521932150 C Co:1:083:0 0 16 >
ffff88006249e480 3521932190 S Co:1:083:0 s 40 a0 0025 0000 000d 13 = e0f53953 80fd053a 80dc7580 01
ffff88006249e480 3521932274 C Co:1:083:0 0 13 >
ffff88006249e480 3521932467 S Co:1:083:0 s 40 a0 0032 0000 0001 1 = 22
ffff88006249e480 3521932525 C Co:1:083:0 0 1 >
ffff88006249e480 3521932562 S Co:1:083:0 s 40 a0 12c4 0000 0008 8 = 7f211200 0380f922
ffff88006249e480 3521932650 C Co:1:083:0 0 8 >
ffff88006249e480 3521932686 S Co:1:083:0 s 40 a0 0046 0000 000a 10 = 00010202 03030404 0505
ffff88006249e480 3521932775 C Co:1:083:0 0 10 >
ffff88006249e480 3521932816 S Co:1:083:0 s 40 a0 048e 0000 0010 16 = 75150075 14007513 00751200 c203c200
ffff88006249e480 3521932901 C Co:1:083:0 0 16 >
ffff88006249e480 3521932942 S Co:1:083:0 s 40 a0 049e 0000 0010 16 = c202c201 1212d07b ff7a0079 56ae02af
ffff88006249e480 3521933026 C Co:1:083:0 0 16 >
ffff88006249e480 3521933068 S Co:1:083:0 s 40 a0 04ae 0000 0010 16 = 018e238f 247bff7a 007968ae 02af018e
ffff88006249e480 3521933151 C Co:1:083:0 0 16 >
ffff88006249e480 3521933192 S Co:1:083:0 s 40 a0 04be 0000 0010 16 = 2b8f2c7b ff7a0079 72ae02af 018e218f
ffff88006249e480 3521933275 C Co:1:083:0 0 16 >
ffff88006249e480 3521933317 S Co:1:083:0 s 40 a0 04ce 0000 0010 16 = 227bff7a 0079a0ae 02af018e 298f2a7b
ffff88006249e480 3521933400 C Co:1:083:0 0 16 >
ffff88006249e480 3521933442 S Co:1:083:0 s 40 a0 04de 0000 0010 16 = ff7a0079 ceae02af 018e2d8f 2e7bff7a
ffff88006249e480 3521933526 C Co:1:083:0 0 16 >
ffff88006249e480 3521933568 S Co:1:083:0 s 40 a0 04ee 0000 0010 16 = 007956ae 02af01ee 54e0fe7f 00ef4e70
ffff88006249e480 3521933651 C Co:1:083:0 0 16 >
ffff88006249e480 3521933692 S Co:1:083:0 s 40 a0 04fe 0000 0010 16 = 0302067d 75160075 17807bff 7a007956
ffff88006249e480 3521933776 C Co:1:083:0 0 16 >
ffff88006249e480 3521933818 S Co:1:083:0 s 40 a0 050e 0000 0010 16 = ae02af01 8e188f19 7bff7a00 7956ae02
ffff88006249e480 3521933900 C Co:1:083:0 0 16 >
ffff88006249e480 3521933943 S Co:1:083:0 s 40 a0 051e 0000 0010 16 = af017bff 7a0079f4 ac02ad01 c3ed9fff
ffff88006249e480 3521934023 C Co:1:083:0 0 16 >
ffff88006249e480 3521934343 S Co:1:083:0 s 40 a0 052e 0000 0010 16 = ec9efeef 2402ffee 3400fee4 fcfd8f11
ffff88006249e480 3521934398 C Co:1:083:0 0 16 >
ffff88006249e480 3521934518 S Co:1:083:0 s 40 a0 053e 0000 0010 16 = 8e108d0f 8c0e750b 00750a00 75090075
ffff88006249e480 3521934652 C Co:1:083:0 0 16 >
ffff88006249e480 3521934706 S Co:1:083:0 s 40 a0 054e 0000 0010 16 = 0800af11 ae10ad0f ac0eab0b aa0aa909
ffff88006249e480 3521934776 C Co:1:083:0 0 16 >
ffff88006249e480 3521934896 S Co:1:083:0 s 40 a0 055e 0000 0010 16 = a808c312 0db0503b ae0aaf0b ac16ad17
ffff88006249e480 3521935027 C Co:1:083:0 0 16 >
ffff88006249e480 3521935083 S Co:1:083:0 s 40 a0 056e 0000 0010 16 = 8d828c83 e5822ff5 82e5833e f58374cd
ffff88006249e480 3521935148 C Co:1:083:0 0 16 >
ffff88006249e480 3521935254 S Co:1:083:0 s 40 a0 057e 0000 0010 16 = f0af0bae 0aad09ac 087b017a 00790078
ffff88006249e480 3521935402 C Co:1:083:0 0 16 >
ffff88006249e480 3521935459 S Co:1:083:0 s 40 a0 058e 0000 0010 16 = 00ef2bf5 0bee3af5 0aed39f5 09ec38f5
ffff88006249e480 3521935524 C Co:1:083:0 0 16 >
ffff88006249e480 3521935634 S Co:1:083:0 s 40 a0 059e 0000 0010 16 = 0880af75 0b00750a 00750900 750800af
ffff88006249e480 3521935777 C Co:1:083:0 0 16 >
ffff88006249e480 3521935834 S Co:1:083:0 s 40 a0 05ae 0000 0010 16 = 11ae10ad 0fac0eab 0baa0aa9 09a808c3
ffff88006249e480 3521935899 C Co:1:083:0 0 16 >
ffff88006249e480 3521936009 S Co:1:083:0 s 40 a0 05be 0000 0010 16 = 120db050 52ae0aaf 0bac18ad 198d828c
ffff88006249e480 3521936152 C Co:1:083:0 0 16 >
ffff88006249e480 3521936208 S Co:1:083:0 s 40 a0 05ce 0000 0010 16 = 83e5822f f582e583 3ef583e0 ffac0aad
ffff88006249e480 3521936273 C Co:1:083:0 0 16 >
ffff88006249e480 3521936381 S Co:1:083:0 s 40 a0 05de 0000 0010 16 = 0baa16ab 178b828a 83e5822d f582e583
ffff88006249e480 3521936527 C Co:1:083:0 0 16 >
ffff88006249e480 3521936586 S Co:1:083:0 s 40 a0 05ee 0000 0010 16 = 3cf583ef f0af0bae 0aad09ac 087b017a
ffff88006249e480 3521936649 C Co:1:083:0 0 16 >
ffff88006249e480 3521936760 S Co:1:083:0 s 40 a0 05fe 0000 0010 16 = 00790078 00ef2bf5 0bee3af5 0aed39f5
ffff88006249e480 3521936902 C Co:1:083:0 0 16 >
ffff88006249e480 3521936959 S Co:1:083:0 s 40 a0 060e 0000 0010 16 = 09ec38f5 08809885 16238517 247bff7a
ffff88006249e480 3521937028 C Co:1:083:0 0 16 >
ffff88006249e480 3521937081 S Co:1:083:0 s 40 a0 061e 0000 0010 16 = 007956ae 02af01ef 2480f50d ee34fff5
ffff88006249e480 3521937152 C Co:1:083:0 0 16 >
ffff88006249e480 3521937200 S Co:1:083:0 s 40 a0 062e 0000 0010 16 = 0cc3e52c 950df52c e52b950c f52bc3e5
ffff88006249e480 3521937277 C Co:1:083:0 0 16 >
ffff88006249e480 3521937325 S Co:1:083:0 s 40 a0 063e 0000 0010 16 = 26950df5 26e52595 0cf525c3 e528950d
ffff88006249e480 3521937402 C Co:1:083:0 0 16 >
ffff88006249e480 3521937448 S Co:1:083:0 s 40 a0 064e 0000 0010 16 = f528e527 950cf527 c3e52295 0df522e5
ffff88006249e480 3521937526 C Co:1:083:0 0 16 >
ffff88006249e480 3521937575 S Co:1:083:0 s 40 a0 065e 0000 0010 16 = 21950cf5 21c3e52a 950df52a e529950c
ffff88006249e480 3521937652 C Co:1:083:0 0 16 >
ffff88006249e480 3521937700 S Co:1:083:0 s 40 a0 066e 0000 0010 16 = f529c3e5 2e950df5 2ee52d95 0cf52dd2
ffff88006249e480 3521937777 C Co:1:083:0 0 16 >
ffff88006249e480 3521937824 S Co:1:083:0 s 40 a0 067e 0000 0010 16 = e843d820 90e668e0 ffef4409 ff90e668
ffff88006249e480 3521937903 C Co:1:083:0 0 16 >
ffff88006249e480 3521937950 S Co:1:083:0 s 40 a0 068e 0000 0010 16 = eff090e6 5ce0ffef 443dff90 e65ceff0
ffff88006249e480 3521938027 C Co:1:083:0 0 16 >
ffff88006249e480 3521938075 S Co:1:083:0 s 40 a0 069e 0000 0010 16 = d2af90e6 80e0ffef 20e105d2 05121171
ffff88006249e480 3521938152 C Co:1:083:0 0 16 >
ffff88006249e480 3521938199 S Co:1:083:0 s 40 a0 06ae 0000 0010 16 = 90e680e0 ffef54f7 ff90e680 eff0538e
ffff88006249e480 3521938277 C Co:1:083:0 0 16 >
ffff88006249e480 3521938325 S Co:1:083:0 s 40 a0 06be 0000 0010 16 = f8c20330 01051200 f6c20130 03371212
ffff88006249e480 3521938402 C Co:1:083:0 0 16 >
ffff88006249e480 3521938450 S Co:1:083:0 s 40 a0 06ce 0000 0010 16 = d85032c2 031211f8 20002490 e682e0ff
ffff88006249e480 3521938527 C Co:1:083:0 0 16 >
ffff88006249e480 3521938576 S Co:1:083:0 s 40 a0 06de 0000 0010 16 = ef30e709 90e682e0 ffef20e1 e890e682
ffff88006249e480 3521938653 C Co:1:083:0 0 16 >
ffff88006249e480 3521938701 S Co:1:083:0 s 40 a0 06ee 0000 0010 16 = e0ffef30 e60990e6 82e0ffef 20e0d612
ffff88006249e480 3521938776 C Co:1:083:0 0 16 >
ffff88006249e480 3521938819 S Co:1:083:0 s 40 a0 06fe 0000 000a 10 = 11a01212 dc1212d4 80b9
ffff88006249e480 3521938902 C Co:1:083:0 0 10 >
ffff88006249e480 3521938935 S Co:1:083:0 s 40 a0 0708 0000 0001 1 = 22
ffff88006249e480 3521939027 C Co:1:083:0 0 1 >
ffff88006249e480 3521939075 S Co:1:083:0 s 40 a0 00f6 0000 0010 16 = 90e6b9e0 ffef120d c1022d00 02ff0103
ffff88006249e480 3521939152 C Co:1:083:0 0 16 >
ffff88006249e480 3521939199 S Co:1:083:0 s 40 a0 0106 0000 0010 16 = d603011b 06022708 02210902 150a021b
ffff88006249e480 3521939277 C Co:1:083:0 0 16 >
ffff88006249e480 3521939346 S Co:1:083:0 s 40 a0 0116 0000 0010 16 = 0b000004 6c120040 40030204 7f90e6bb
ffff88006249e480 3521939402 C Co:1:083:0 0 16 >
ffff88006249e480 3521939450 S Co:1:083:0 s 40 a0 0126 0000 0010 16 = e0ffef12 0dc1013f 01017702 01af0301
ffff88006249e480 3521939527 C Co:1:083:0 0 16 >
ffff88006249e480 3521939575 S Co:1:083:0 s 40 a0 0136 0000 0010 16 = 5b060193 07000002 04e523ff 7e00ef54
ffff88006249e480 3521939652 C Co:1:083:0 0 16 >
ffff88006249e480 3521939703 S Co:1:083:0 s 40 a0 0146 0000 0010 16 = ffff90e6 b3eff0af 24ef54ff ff90e6b4
ffff88006249e480 3521939777 C Co:1:083:0 0 16 >
ffff88006249e480 3521939824 S Co:1:083:0 s 40 a0 0156 0000 0010 16 = eff00204 7fe52bff 7e00ef54 ffff90e6
ffff88006249e480 3521939903 C Co:1:083:0 0 16 >
ffff88006249e480 3521939951 S Co:1:083:0 s 40 a0 0166 0000 0010 16 = b3eff0af 2cef54ff ff90e6b4 eff00204
ffff88006249e480 3521940027 C Co:1:083:0 0 16 >
ffff88006249e480 3521940074 S Co:1:083:0 s 40 a0 0176 0000 0010 16 = 7fe525ff 7e00ef54 ffff90e6 b3eff0af
ffff88006249e480 3521940152 C Co:1:083:0 0 16 >
ffff88006249e480 3521940200 S Co:1:083:0 s 40 a0 0186 0000 0010 16 = 26ef54ff ff90e6b4 eff00204 7fe527ff
ffff88006249e480 3521940277 C Co:1:083:0 0 16 >
ffff88006249e480 3521940324 S Co:1:083:0 s 40 a0 0196 0000 0010 16 = 7e00ef54 ffff90e6 b3eff0af 28ef54ff
ffff88006249e480 3521940401 C Co:1:083:0 0 16 >
ffff88006249e480 3521940448 S Co:1:083:0 s 40 a0 01a6 0000 0010 16 = ff90e6b4 eff00204 7f90e6ba e0ff1211
ffff88006249e480 3521940527 C Co:1:083:0 0 16 >
ffff88006249e480 3521940573 S Co:1:083:0 s 40 a0 01b6 0000 0010 16 = ccaa06a9 077b018b 368a3789 38ea494b
ffff88006249e480 3521940653 C Co:1:083:0 0 16 >
ffff88006249e480 3521940700 S Co:1:083:0 s 40 a0 01c6 0000 0010 16 = 602bab36 aa37a938 ae02af01 eeff7e00
ffff88006249e480 3521940776 C Co:1:083:0 0 16 >
ffff88006249e480 3521940823 S Co:1:083:0 s 40 a0 01d6 0000 0010 16 = ef54ffff 90e6b3ef f0ab36aa 37a938af
ffff88006249e480 3521940902 C Co:1:083:0 0 16 >
ffff88006249e480 3521940949 S Co:1:083:0 s 40 a0 01e6 0000 0010 16 = 01ef54ff ff90e6b4 eff00204 7f90e6a0
ffff88006249e480 3521941026 C Co:1:083:0 0 16 >
ffff88006249e480 3521941073 S Co:1:083:0 s 40 a0 01f6 0000 0010 16 = e0ffef44 01ff90e6 a0eff002 047f90e6
ffff88006249e480 3521941152 C Co:1:083:0 0 16 >
ffff88006249e480 3521941211 S Co:1:083:0 s 40 a0 0206 0000 0010 16 = a0e0ffef 4401ff90 e6a0eff0 02047f12
ffff88006249e480 3521941276 C Co:1:083:0 0 16 >
ffff88006249e480 3521941325 S Co:1:083:0 s 40 a0 0216 0000 0010 16 = 129f0204 7f1212bb 02047f12 12b20204
ffff88006249e480 3521941401 C Co:1:083:0 0 16 >
ffff88006249e480 3521941449 S Co:1:083:0 s 40 a0 0226 0000 0010 16 = 7f12128c 02047f12 00504003 02047f90
ffff88006249e480 3521941527 C Co:1:083:0 0 16 >
ffff88006249e480 3521941569 S Co:1:083:0 s 40 a0 0236 0000 0010 16 = e6b8e0ff ef120dc1 024b8002 7481028c
ffff88006249e480 3521941651 C Co:1:083:0 0 16 >
ffff88006249e480 3521941693 S Co:1:083:0 s 40 a0 0246 0000 0010 16 = 82000002 eea200e4 33ffef25 e0ffa202
ffff88006249e480 3521941776 C Co:1:083:0 0 16 >
ffff88006249e480 3521941819 S Co:1:083:0 s 40 a0 0256 0000 0010 16 = e433feef 4eff90e7 40eff090 e741e4f0
ffff88006249e480 3521941901 C Co:1:083:0 0 16 >
ffff88006249e480 3521941943 S Co:1:083:0 s 40 a0 0266 0000 0010 16 = 90e68ae4 f090e68b 7402f002 047f90e7
ffff88006249e480 3521942026 C Co:1:083:0 0 16 >
ffff88006249e480 3521942068 S Co:1:083:0 s 40 a0 0276 0000 0010 16 = 40e4f090 e741e4f0 90e68ae4 f090e68b
ffff88006249e480 3521942151 C Co:1:083:0 0 16 >
ffff88006249e480 3521942193 S Co:1:083:0 s 40 a0 0286 0000 0010 16 = 7402f002 047f90e6 bce0ffef 547eff7e
ffff88006249e480 3521942277 C Co:1:083:0 0 16 >
ffff88006249e480 3521942320 S Co:1:083:0 s 40 a0 0296 0000 0010 16 = 0090e6bc e0fdedd3 94804006 7c007d01
ffff88006249e480 3521942402 C Co:1:083:0 0 16 >
ffff88006249e480 3521942444 S Co:1:083:0 s 40 a0 02a6 0000 0010 16 = 80047c00 7d00ec4e feed4fff 74462ff5
ffff88006249e480 3521942527 C Co:1:083:0 0 16 >
ffff88006249e480 3521942569 S Co:1:083:0 s 40 a0 02b6 0000 0010 16 = 8274003e f583e493 ffef3395 e0feef24
ffff88006249e480 3521942649 C Co:1:083:0 0 16 >
ffff88006249e480 3521942898 S Co:1:083:0 s 40 a0 02c6 0000 0010 16 = a1ffee34 e6fe8f82 8e83e0ff ef5401ff
ffff88006249e480 3521943027 C Co:1:083:0 0 16 >
ffff88006249e480 3521943070 S Co:1:083:0 s 40 a0 02d6 0000 0010 16 = 90e740ef f090e741 e4f090e6 8ae4f090
ffff88006249e480 3521943151 C Co:1:083:0 0 16 >
ffff88006249e480 3521943193 S Co:1:083:0 s 40 a0 02e6 0000 0010 16 = e68b7402 f002047f 90e6a0e0 ffef4401
ffff88006249e480 3521943290 C Co:1:083:0 0 16 >
ffff88006249e480 3521943604 S Co:1:083:0 s 40 a0 02f6 0000 0010 16 = ff90e6a0 eff00204 7f1212e0 40030204
ffff88006249e480 3521943778 C Co:1:083:0 0 16 >
ffff88006249e480 3521943838 S Co:1:083:0 s 40 a0 0306 0000 0010 16 = 7f90e6b8 e0ffef12 0dc1031a 00033902
ffff88006249e480 3521943903 C Co:1:083:0 0 16 >
ffff88006249e480 3521943960 S Co:1:083:0 s 40 a0 0316 0000 0010 16 = 0000047f 90e6bae0 ffefb401 05c20002
ffff88006249e480 3521944027 C Co:1:083:0 0 16 >
ffff88006249e480 3521944086 S Co:1:083:0 s 40 a0 0326 0000 0010 16 = 047f90e6 a0e0ffef 4401ff90 e6a0eff0
ffff88006249e480 3521944152 C Co:1:083:0 0 16 >
ffff88006249e480 3521944211 S Co:1:083:0 s 40 a0 0336 0000 0010 16 = 02047f90 e6bae0ff ef600302 03c290e6
ffff88006249e480 3521944278 C Co:1:083:0 0 16 >
ffff88006249e480 3521944336 S Co:1:083:0 s 40 a0 0346 0000 0010 16 = bce0ffef 547eff7e 0090e6bc e0fdedd3
ffff88006249e480 3521944402 C Co:1:083:0 0 16 >
ffff88006249e480 3521944460 S Co:1:083:0 s 40 a0 0356 0000 0010 16 = 94804006 7c007d01 80047c00 7d00ec4e
ffff88006249e480 3521944527 C Co:1:083:0 0 16 >
ffff88006249e480 3521944584 S Co:1:083:0 s 40 a0 0366 0000 0010 16 = feed4fff 74462ff5 8274003e f583e493
ffff88006249e480 3521944652 C Co:1:083:0 0 16 >
ffff88006249e480 3521944710 S Co:1:083:0 s 40 a0 0376 0000 0010 16 = ffef3395 e0feef24 a1ffee34 e6fe8f82
ffff88006249e480 3521944776 C Co:1:083:0 0 16 >
ffff88006249e480 3521944834 S Co:1:083:0 s 40 a0 0386 0000 0010 16 = 8e83e0ff ef54feff eff090e6 bce0ffef
ffff88006249e480 3521944903 C Co:1:083:0 0 16 >
ffff88006249e480 3521944960 S Co:1:083:0 s 40 a0 0396 0000 0010 16 = 5480ffef 13131354 1fff90e6 bce0feee
ffff88006249e480 3521945028 C Co:1:083:0 0 16 >
ffff88006249e480 3521945085 S Co:1:083:0 s 40 a0 03a6 0000 0010 16 = 540ffeef 2eff90e6 83eff090 e683e0ff
ffff88006249e480 3521945153 C Co:1:083:0 0 16 >
ffff88006249e480 3521945212 S Co:1:083:0 s 40 a0 03b6 0000 0010 16 = ef4420ff 90e683ef f002047f 90e6a0e0
ffff88006249e480 3521945278 C Co:1:083:0 0 16 >
ffff88006249e480 3521945336 S Co:1:083:0 s 40 a0 03c6 0000 0010 16 = ffef4401 ff90e6a0 eff00204 7f02047f
ffff88006249e480 3521945403 C Co:1:083:0 0 16 >
ffff88006249e480 3521945461 S Co:1:083:0 s 40 a0 03d6 0000 0010 16 = 1212e240 0302047f 90e6b8e0 ffef120d
ffff88006249e480 3521945527 C Co:1:083:0 0 16 >
ffff88006249e480 3521945585 S Co:1:083:0 s 40 a0 03e6 0000 0010 16 = c103f100 041c0200 00047f90 e6bae0ff
ffff88006249e480 3521945653 C Co:1:083:0 0 16 >
ffff88006249e480 3521945712 S Co:1:083:0 s 40 a0 03f6 0000 0010 16 = efb40105 d2000204 7f90e6ba e0ffefb4
ffff88006249e480 3521945778 C Co:1:083:0 0 16 >
ffff88006249e480 3521945836 S Co:1:083:0 s 40 a0 0406 0000 0010 16 = 02048075 807390e6 a0e0ffef 4401ff90
ffff88006249e480 3521945903 C Co:1:083:0 0 16 >
ffff88006249e480 3521945960 S Co:1:083:0 s 40 a0 0416 0000 0010 16 = e6a0eff0 806390e6 bce0ffef 547eff7e
ffff88006249e480 3521946027 C Co:1:083:0 0 16 >
ffff88006249e480 3521946085 S Co:1:083:0 s 40 a0 0426 0000 0010 16 = 0090e6bc e0fdedd3 94804006 7c007d01
ffff88006249e480 3521946153 C Co:1:083:0 0 16 >
ffff88006249e480 3521946211 S Co:1:083:0 s 40 a0 0436 0000 0010 16 = 80047c00 7d00ec4e feed4fff 74462ff5
ffff88006249e480 3521946280 C Co:1:083:0 0 16 >
ffff88006249e480 3521946338 S Co:1:083:0 s 40 a0 0446 0000 0010 16 = 8274003e f583e493 ffef3395 e0feef24
ffff88006249e480 3521946402 C Co:1:083:0 0 16 >
ffff88006249e480 3521946460 S Co:1:083:0 s 40 a0 0456 0000 0010 16 = a1ffee34 e6fe8f82 8e83e0ff ef4401ff
ffff88006249e480 3521946527 C Co:1:083:0 0 16 >
ffff88006249e480 3521946584 S Co:1:083:0 s 40 a0 0466 0000 0010 16 = eff08015 80131212 e4500e90 e6a0e0ff
ffff88006249e480 3521946653 C Co:1:083:0 0 16 >
ffff88006249e480 3521946712 S Co:1:083:0 s 40 a0 0476 0000 0010 16 = ef4401ff 90e6a0ef f090e6a0 e0ffef44
ffff88006249e480 3521946778 C Co:1:083:0 0 16 >
ffff88006249e480 3521946827 S Co:1:083:0 s 40 a0 0486 0000 0007 7 = 80ff90e6 a0eff0
ffff88006249e480 3521946902 C Co:1:083:0 0 7 >
ffff88006249e480 3521946946 S Co:1:083:0 s 40 a0 048d 0000 0001 1 = 22
ffff88006249e480 3521947027 C Co:1:083:0 0 1 >
ffff88006249e480 3521947072 S Co:1:083:0 s 40 a0 0033 0000 0003 3 = 0212cc
ffff88006249e480 3521947153 C Co:1:083:0 0 3 >
ffff88006249e480 3521947200 S Co:1:083:0 s 40 a0 12cc 0000 0004 4 = 53d8ef32
ffff88006249e480 3521947291 C Co:1:083:0 0 4 >
ffff88006249e480 3521947355 S Co:1:083:0 s 40 a0 11a0 0000 0010 16 = 90e682e0 30e004e0 20e60b90 e682e030
ffff88006249e480 3521947402 C Co:1:083:0 0 16 >
ffff88006249e480 3521947460 S Co:1:083:0 s 40 a0 11b0 0000 0010 16 = e119e030 e71590e6 80e04401 f07f147e
ffff88006249e480 3521947528 C Co:1:083:0 0 16 >
ffff88006249e480 3521947582 S Co:1:083:0 s 40 a0 11c0 0000 000c 12 = 001210e7 90e680e0 54fef022
ffff88006249e480 3521947652 C Co:1:083:0 0 12 >
ffff88006249e480 3521947709 S Co:1:083:0 s 40 a0 11f8 0000 0010 16 = 90e682e0 44c0f090 e681f043 87010000
ffff88006249e480 3521947788 C Co:1:083:0 0 16 >
ffff88006249e480 3521947860 S Co:1:083:0 s 40 a0 1208 0000 0004 4 = 00000022
ffff88006249e480 3521948029 C Co:1:083:0 0 4 >
ffff88006249e480 3521948087 S Co:1:083:0 s 40 a0 1171 0000 0010 16 = 30050990 e680e044 0af08007 90e680e0
ffff88006249e480 3521948152 C Co:1:083:0 0 16 >
ffff88006249e480 3521948210 S Co:1:083:0 s 40 a0 1181 0000 0010 16 = 4408f07f dc7e0512 10e790e6 5d74fff0
ffff88006249e480 3521948278 C Co:1:083:0 0 16 >
ffff88006249e480 3521948335 S Co:1:083:0 s 40 a0 1191 0000 000f 15 = 90e65ff0 5391ef90 e680e054 f7f022
ffff88006249e480 3521948403 C Co:1:083:0 0 15 >
ffff88006249e480 3521948447 S Co:1:083:0 s 40 a0 11cc 0000 0002 2 = a907
ffff88006249e480 3521948528 C Co:1:083:0 0 2 >
ffff88006249e480 3521948586 S Co:1:083:0 s 40 a0 11ce 0000 0010 16 = ae2daf2e 8f828e83 a3e06403 7017ad01
ffff88006249e480 3521948652 C Co:1:083:0 0 16 >
ffff88006249e480 3521948710 S Co:1:083:0 s 40 a0 11de 0000 0010 16 = 19ed7001 228f828e 83e07c00 2ffdec3e
ffff88006249e480 3521948778 C Co:1:083:0 0 16 >
ffff88006249e480 3521948830 S Co:1:083:0 s 40 a0 11ee 0000 0009 9 = feaf0580 df7e007f 00
ffff88006249e480 3521948902 C Co:1:083:0 0 9 >
ffff88006249e480 3521948946 S Co:1:083:0 s 40 a0 11f7 0000 0001 1 = 22
ffff88006249e480 3521949027 C Co:1:083:0 0 1 >
ffff88006249e480 3521949085 S Co:1:083:0 s 40 a0 10e7 0000 0010 16 = 8e3f8f40 90e600e0 54187012 e5402401
ffff88006249e480 3521949153 C Co:1:083:0 0 16 >
ffff88006249e480 3521949211 S Co:1:083:0 s 40 a0 10f7 0000 0010 16 = ffe4353f c313f53f ef13f540 801590e6
ffff88006249e480 3521949278 C Co:1:083:0 0 16 >
ffff88006249e480 3521949336 S Co:1:083:0 s 40 a0 1107 0000 0010 16 = 00e05418 ffbf100b e54025e0 f540e53f
ffff88006249e480 3521949404 C Co:1:083:0 0 16 >
ffff88006249e480 3521949461 S Co:1:083:0 s 40 a0 1117 0000 0010 16 = 33f53fe5 401540ae 3f700215 3f4e6005
ffff88006249e480 3521949528 C Co:1:083:0 0 16 >
ffff88006249e480 3521949576 S Co:1:083:0 s 40 a0 1127 0000 0006 6 = 12120c80 ee22
ffff88006249e480 3521949653 C Co:1:083:0 0 6 >
ffff88006249e480 3521949710 S Co:1:083:0 s 40 a0 120c 0000 0010 16 = 7400f586 90fda57c 05a3e582 458370f9
ffff88006249e480 3521949778 C Co:1:083:0 0 16 >
ffff88006249e480 3521949823 S Co:1:083:0 s 40 a0 121c 0000 0001 1 = 22
ffff88006249e480 3521949902 C Co:1:083:0 0 1 >
ffff88006249e480 3521949948 S Co:1:083:0 s 40 a0 0043 0000 0003 3 = 020e00
ffff88006249e480 3521950028 C Co:1:083:0 0 3 >
ffff88006249e480 3521950073 S Co:1:083:0 s 40 a0 0053 0000 0003 3 = 020e00
ffff88006249e480 3521950153 C Co:1:083:0 0 3 >
ffff88006249e480 3521950210 S Co:1:083:0 s 40 a0 0e00 0000 0010 16 = 020de700 02126300 02124d00 02121d00
ffff88006249e480 3521950279 C Co:1:083:0 0 16 >
ffff88006249e480 3521950338 S Co:1:083:0 s 40 a0 0e10 0000 0010 16 = 02109e00 020fb400 02004200 02005200
ffff88006249e480 3521950404 C Co:1:083:0 0 16 >
ffff88006249e480 3521950759 S Co:1:083:0 s 40 a0 0e20 0000 0010 16 = 020dff00 0212ea00 0212eb00 02100600
ffff88006249e480 3521950904 C Co:1:083:0 0 16 >
ffff88006249e480 3521950962 S Co:1:083:0 s 40 a0 0e30 0000 0010 16 = 02105200 0212ec00 0212ed00 0212ee00
ffff88006249e480 3521951027 C Co:1:083:0 0 16 >
ffff88006249e480 3521951084 S Co:1:083:0 s 40 a0 0e40 0000 0010 16 = 0212ef00 02005200 0212f000 0212f100
ffff88006249e480 3521951153 C Co:1:083:0 0 16 >
ffff88006249e480 3521951209 S Co:1:083:0 s 40 a0 0e50 0000 0010 16 = 0212f200 0212f300 0212f400 0212f500
ffff88006249e480 3521951292 C Co:1:083:0 0 16 >
ffff88006249e480 3521951355 S Co:1:083:0 s 40 a0 0e60 0000 0010 16 = 0212f600 02005200 02005200 02005200
ffff88006249e480 3521951528 C Co:1:083:0 0 16 >
ffff88006249e480 3521951587 S Co:1:083:0 s 40 a0 0e70 0000 0010 16 = 0212f700 0212f800 0212f900 0212fa00
ffff88006249e480 3521951653 C Co:1:083:0 0 16 >
ffff88006249e480 3521951708 S Co:1:083:0 s 40 a0 0e80 0000 0010 16 = 0212fb00 0212fc00 0212fd00 0212fe00
ffff88006249e480 3521951778 C Co:1:083:0 0 16 >
ffff88006249e480 3521951835 S Co:1:083:0 s 40 a0 0e90 0000 0010 16 = 0212ff00 02130000 02130100 02130200
ffff88006249e480 3521951903 C Co:1:083:0 0 16 >
ffff88006249e480 3521951960 S Co:1:083:0 s 40 a0 0ea0 0000 0010 16 = 02112d00 02130300 02130400 02130500
ffff88006249e480 3521952029 C Co:1:083:0 0 16 >
ffff88006249e480 3521952078 S Co:1:083:0 s 40 a0 0eb0 0000 0008 8 = 02130600 02130700
ffff88006249e480 3521952153 C Co:1:083:0 0 8 >
ffff88006249e480 3521952209 S Co:1:083:0 s 40 a0 0056 0000 0010 16 = 12010002 ffffff40 25098138 00000102
ffff88006249e480 3521952279 C Co:1:083:0 0 16 >
ffff88006249e480 3521952335 S Co:1:083:0 s 40 a0 0066 0000 0010 16 = 00010a06 0002ffff ff400100 09022e00
ffff88006249e480 3521952403 C Co:1:083:0 0 16 >
ffff88006249e480 3521952459 S Co:1:083:0 s 40 a0 0076 0000 0010 16 = 01010080 32090400 0004ffff ff000705
ffff88006249e480 3521952528 C Co:1:083:0 0 16 >
ffff88006249e480 3521952584 S Co:1:083:0 s 40 a0 0086 0000 0010 16 = 01020002 00070581 02000200 07058202
ffff88006249e480 3521952654 C Co:1:083:0 0 16 >
ffff88006249e480 3521952710 S Co:1:083:0 s 40 a0 0096 0000 0010 16 = 00020007 05060200 02000902 2e000101
ffff88006249e480 3521952779 C Co:1:083:0 0 16 >
ffff88006249e480 3521952835 S Co:1:083:0 s 40 a0 00a6 0000 0010 16 = 00803209 04000003 ffffff00 07050102
ffff88006249e480 3521952904 C Co:1:083:0 0 16 >
ffff88006249e480 3521952959 S Co:1:083:0 s 40 a0 00b6 0000 0010 16 = 40000007 05810240 00000705 82024000
ffff88006249e480 3521953027 C Co:1:083:0 0 16 >
ffff88006249e480 3521953084 S Co:1:083:0 s 40 a0 00c6 0000 0010 16 = 00070506 02400000 04030904 16035300
ffff88006249e480 3521953153 C Co:1:083:0 0 16 >
ffff88006249e480 3521953210 S Co:1:083:0 s 40 a0 00d6 0000 0010 16 = 61006c00 65006100 65002000 4c004c00
ffff88006249e480 3521953279 C Co:1:083:0 0 16 >
ffff88006249e480 3521953334 S Co:1:083:0 s 40 a0 00e6 0000 0010 16 = 43000c03 4c006f00 67006900 63000000
ffff88006249e480 3521953403 C Co:1:083:0 0 16 >
ffff88006249e480 3521953449 S Co:1:083:0 s 40 a0 12d0 0000 0004 4 = 120f4422
ffff88006249e480 3521953528 C Co:1:083:0 0 4 >
ffff88006249e480 3521953573 S Co:1:083:0 s 40 a0 12d4 0000 0004 4 = 12123522
ffff88006249e480 3521953653 C Co:1:083:0 0 4 >
ffff88006249e480 3521953699 S Co:1:083:0 s 40 a0 12d8 0000 0004 4 = 1212e622
ffff88006249e480 3521953778 C Co:1:083:0 0 4 >
ffff88006249e480 3521953823 S Co:1:083:0 s 40 a0 12dc 0000 0004 4 = 1212e822
ffff88006249e480 3521953904 C Co:1:083:0 0 4 >
ffff88006249e480 3521953948 S Co:1:083:0 s 40 a0 0040 0000 0002 2 = d322
ffff88006249e480 3521954029 C Co:1:083:0 0 2 >
ffff88006249e480 3521954079 S Co:1:083:0 s 40 a0 12b2 0000 0009 9 = 90e6bae0 ff8f3cd3 22
ffff88006249e480 3521954153 C Co:1:083:0 0 9 >
ffff88006249e480 3521954210 S Co:1:083:0 s 40 a0 128c 0000 0010 16 = 90e740e5 3cf090e6 8ae4f090 e68b7401
ffff88006249e480 3521954280 C Co:1:083:0 0 16 >
ffff88006249e480 3521954325 S Co:1:083:0 s 40 a0 129c 0000 0003 3 = f0d322
ffff88006249e480 3521954404 C Co:1:083:0 0 3 >
ffff88006249e480 3521954454 S Co:1:083:0 s 40 a0 12bb 0000 0009 9 = 90e6bae0 ff8f3bd3 22
ffff88006249e480 3521954528 C Co:1:083:0 0 9 >
ffff88006249e480 3521954585 S Co:1:083:0 s 40 a0 129f 0000 0010 16 = 90e740e5 3bf090e6 8ae4f090 e68b7401
ffff88006249e480 3521954654 C Co:1:083:0 0 16 >
ffff88006249e480 3521954700 S Co:1:083:0 s 40 a0 12af 0000 0003 3 = f0d322
ffff88006249e480 3521954779 C Co:1:083:0 0 3 >
ffff88006249e480 3521954823 S Co:1:083:0 s 40 a0 0050 0000 0002 2 = d322
ffff88006249e480 3521954900 C Co:1:083:0 0 2 >
ffff88006249e480 3521955905 S Co:1:083:0 s 40 a0 12e0 0000 0002 2 = d322
ffff88006249e480 3521956031 C Co:1:083:0 0 2 >
ffff88006249e480 3521956082 S Co:1:083:0 s 40 a0 12e2 0000 0002 2 = d322
ffff88006249e480 3521956153 C Co:1:083:0 0 2 >
ffff88006249e480 3521956199 S Co:1:083:0 s 40 a0 12e4 0000 0002 2 = d322
ffff88006249e480 3521956279 C Co:1:083:0 0 2 >
ffff88006249e480 3521956336 S Co:1:083:0 s 40 a0 0de7 0000 0010 16 = c0e0c083 c082d201 5391ef90 e65d7401
ffff88006249e480 3521956405 C Co:1:083:0 0 16 >
ffff88006249e480 3521956454 S Co:1:083:0 s 40 a0 0df7 0000 0008 8 = f0d082d0 83d0e032
ffff88006249e480 3521956528 C Co:1:083:0 0 8 >
ffff88006249e480 3521956585 S Co:1:083:0 s 40 a0 124d 0000 0010 16 = c0e0c083 c0825391 ef90e65d 7404f0d0
ffff88006249e480 3521956654 C Co:1:083:0 0 16 >
ffff88006249e480 3521956701 S Co:1:083:0 s 40 a0 125d 0000 0006 6 = 82d083d0 e032
ffff88006249e480 3521956780 C Co:1:083:0 0 6 >
ffff88006249e480 3521956836 S Co:1:083:0 s 40 a0 1263 0000 0010 16 = c0e0c083 c0825391 ef90e65d 7402f0d0
ffff88006249e480 3521956903 C Co:1:083:0 0 16 >
ffff88006249e480 3521956951 S Co:1:083:0 s 40 a0 1273 0000 0006 6 = 82d083d0 e032
ffff88006249e480 3521957028 C Co:1:083:0 0 6 >
ffff88006249e480 3521957086 S Co:1:083:0 s 40 a0 109e 0000 0010 16 = c0e0c083 c082c0d0 75d000c0 06c00785
ffff88006249e480 3521957153 C Co:1:083:0 0 16 >
ffff88006249e480 3521957209 S Co:1:083:0 s 40 a0 10ae 0000 0010 16 = 2925852a 26ae25af 268f828e 83a37402
ffff88006249e480 3521957279 C Co:1:083:0 0 16 >
ffff88006249e480 3521957336 S Co:1:083:0 s 40 a0 10be 0000 0010 16 = f0852127 852228ae 27af288f 828e83a3
ffff88006249e480 3521957403 C Co:1:083:0 0 16 >
ffff88006249e480 3521957460 S Co:1:083:0 s 40 a0 10ce 0000 0010 16 = 7407f053 91ef90e6 5d7410f0 d007d006
ffff88006249e480 3521957530 C Co:1:083:0 0 16 >
ffff88006249e480 3521957580 S Co:1:083:0 s 40 a0 10de 0000 0009 9 = d0d0d082 d083d0e0 32
ffff88006249e480 3521957655 C Co:1:083:0 0 9 >
ffff88006249e480 3521957711 S Co:1:083:0 s 40 a0 121d 0000 0010 16 = c0e0c083 c082d203 5391ef90 e65d7408
ffff88006249e480 3521957779 C Co:1:083:0 0 16 >
ffff88006249e480 3521957829 S Co:1:083:0 s 40 a0 122d 0000 0008 8 = f0d082d0 83d0e032
ffff88006249e480 3521957901 C Co:1:083:0 0 8 >
ffff88006249e480 3521957965 S Co:1:083:0 s 40 a0 0fb4 0000 0010 16 = c0e0c083 c082c0d0 75d000c0 06c00790
ffff88006249e480 3521958029 C Co:1:083:0 0 16 >
ffff88006249e480 3521958314 S Co:1:083:0 s 40 a0 0fc4 0000 0010 16 = e680e0ff ef30e724 85212585 2226ae25
ffff88006249e480 3521958404 C Co:1:083:0 0 16 >
ffff88006249e480 3521958461 S Co:1:083:0 s 40 a0 0fd4 0000 0010 16 = af268f82 8e83a374 02f08529 27852a28
ffff88006249e480 3521958529 C Co:1:083:0 0 16 >
ffff88006249e480 3521958587 S Co:1:083:0 s 40 a0 0fe4 0000 0010 16 = ae27af28 8f828e83 a37407f0 5391ef90
ffff88006249e480 3521958654 C Co:1:083:0 0 16 >
ffff88006249e480 3521958710 S Co:1:083:0 s 40 a0 0ff4 0000 0010 16 = e65d7420 f0d007d0 06d0d0d0 82d083d0
ffff88006249e480 3521958780 C Co:1:083:0 0 16 >
ffff88006249e480 3521958824 S Co:1:083:0 s 40 a0 1004 0000 0002 2 = e032
ffff88006249e480 3521958903 C Co:1:083:0 0 2 >
ffff88006249e480 3521958947 S Co:1:083:0 s 40 a0 0042 0000 0001 1 = 32
ffff88006249e480 3521959029 C Co:1:083:0 0 1 >
ffff88006249e480 3521959073 S Co:1:083:0 s 40 a0 0052 0000 0001 1 = 32
ffff88006249e480 3521959154 C Co:1:083:0 0 1 >
ffff88006249e480 3521959199 S Co:1:083:0 s 40 a0 0dff 0000 0001 1 = 32
ffff88006249e480 3521959294 C Co:1:083:0 0 1 >
ffff88006249e480 3521959346 S Co:1:083:0 s 40 a0 12ea 0000 0001 1 = 32
ffff88006249e480 3521959405 C Co:1:083:0 0 1 >
ffff88006249e480 3521959448 S Co:1:083:0 s 40 a0 12eb 0000 0001 1 = 32
ffff88006249e480 3521959529 C Co:1:083:0 0 1 >
ffff88006249e480 3521959585 S Co:1:083:0 s 40 a0 1006 0000 0010 16 = c0e0c0f0 c083c082 c0d075d0 00c000c0
ffff88006249e480 3521959655 C Co:1:083:0 0 16 >
ffff88006249e480 3521959712 S Co:1:083:0 s 40 a0 1016 0000 0010 16 = 01c002c0 03c004c0 05c006c0 075391ef
ffff88006249e480 3521959780 C Co:1:083:0 0 16 >
ffff88006249e480 3521959837 S Co:1:083:0 s 40 a0 1026 0000 0010 16 = 90e65fe0 ffef4408 ff90e65f eff01208
ffff88006249e480 3521959905 C Co:1:083:0 0 16 >
ffff88006249e480 3521959962 S Co:1:083:0 s 40 a0 1036 0000 0010 16 = 74d007d0 06d005d0 04d003d0 02d001d0
ffff88006249e480 3521960030 C Co:1:083:0 0 16 >
ffff88006249e480 3521960083 S Co:1:083:0 s 40 a0 1046 0000 000c 12 = 00d0d0d0 82d083d0 f0d0e032
ffff88006249e480 3521960154 C Co:1:083:0 0 12 >
ffff88006249e480 3521960212 S Co:1:083:0 s 40 a0 1052 0000 0010 16 = c0e0c0f0 c083c082 c0d075d0 00c000c0
ffff88006249e480 3521960279 C Co:1:083:0 0 16 >
ffff88006249e480 3521960336 S Co:1:083:0 s 40 a0 1062 0000 0010 16 = 01c002c0 03c004c0 05c006c0 075391ef
ffff88006249e480 3521960404 C Co:1:083:0 0 16 >
ffff88006249e480 3521960461 S Co:1:083:0 s 40 a0 1072 0000 0010 16 = 90e65fe0 ffef4410 ff90e65f eff01213
ffff88006249e480 3521960530 C Co:1:083:0 0 16 >
ffff88006249e480 3521960586 S Co:1:083:0 s 40 a0 1082 0000 0010 16 = 08d007d0 06d005d0 04d003d0 02d001d0
ffff88006249e480 3521960655 C Co:1:083:0 0 16 >
ffff88006249e480 3521960709 S Co:1:083:0 s 40 a0 1092 0000 000c 12 = 00d0d0d0 82d083d0 f0d0e032
ffff88006249e480 3521960780 C Co:1:083:0 0 12 >
ffff88006249e480 3521960823 S Co:1:083:0 s 40 a0 12ec 0000 0001 1 = 32
ffff88006249e480 3521960904 C Co:1:083:0 0 1 >
ffff88006249e480 3521960947 S Co:1:083:0 s 40 a0 12ed 0000 0001 1 = 32
ffff88006249e480 3521961029 C Co:1:083:0 0 1 >
ffff88006249e480 3521961072 S Co:1:083:0 s 40 a0 12ee 0000 0001 1 = 32
ffff88006249e480 3521961155 C Co:1:083:0 0 1 >
ffff88006249e480 3521961198 S Co:1:083:0 s 40 a0 12ef 0000 0001 1 = 32
ffff88006249e480 3521961279 C Co:1:083:0 0 1 >
ffff88006249e480 3521961322 S Co:1:083:0 s 40 a0 12f0 0000 0001 1 = 32
ffff88006249e480 3521961404 C Co:1:083:0 0 1 >
ffff88006249e480 3521961448 S Co:1:083:0 s 40 a0 12f1 0000 0001 1 = 32
ffff88006249e480 3521961530 C Co:1:083:0 0 1 >
ffff88006249e480 3521961573 S Co:1:083:0 s 40 a0 12f2 0000 0001 1 = 32
ffff88006249e480 3521961654 C Co:1:083:0 0 1 >
ffff88006249e480 3521961698 S Co:1:083:0 s 40 a0 12f3 0000 0001 1 = 32
ffff88006249e480 3521961779 C Co:1:083:0 0 1 >
ffff88006249e480 3521961823 S Co:1:083:0 s 40 a0 12f4 0000 0001 1 = 32
ffff88006249e480 3521961904 C Co:1:083:0 0 1 >
ffff88006249e480 3521961947 S Co:1:083:0 s 40 a0 12f5 0000 0001 1 = 32
ffff88006249e480 3521962029 C Co:1:083:0 0 1 >
ffff88006249e480 3521962072 S Co:1:083:0 s 40 a0 12f6 0000 0001 1 = 32
ffff88006249e480 3521962154 C Co:1:083:0 0 1 >
ffff88006249e480 3521962197 S Co:1:083:0 s 40 a0 12f7 0000 0001 1 = 32
ffff88006249e480 3521962281 C Co:1:083:0 0 1 >
ffff88006249e480 3521962325 S Co:1:083:0 s 40 a0 12f8 0000 0001 1 = 32
ffff88006249e480 3521962404 C Co:1:083:0 0 1 >
ffff88006249e480 3521962448 S Co:1:083:0 s 40 a0 12f9 0000 0001 1 = 32
ffff88006249e480 3521962529 C Co:1:083:0 0 1 >
ffff88006249e480 3521962572 S Co:1:083:0 s 40 a0 12fa 0000 0001 1 = 32
ffff88006249e480 3521962654 C Co:1:083:0 0 1 >
ffff88006249e480 3521962698 S Co:1:083:0 s 40 a0 12fb 0000 0001 1 = 32
ffff88006249e480 3521962779 C Co:1:083:0 0 1 >
ffff88006249e480 3521962823 S Co:1:083:0 s 40 a0 12fc 0000 0001 1 = 32
ffff88006249e480 3521962905 C Co:1:083:0 0 1 >
ffff88006249e480 3521962949 S Co:1:083:0 s 40 a0 12fd 0000 0001 1 = 32
ffff88006249e480 3521963029 C Co:1:083:0 0 1 >
ffff88006249e480 3521963072 S Co:1:083:0 s 40 a0 12fe 0000 0001 1 = 32
ffff88006249e480 3521963154 C Co:1:083:0 0 1 >
ffff88006249e480 3521963198 S Co:1:083:0 s 40 a0 12ff 0000 0001 1 = 32
ffff88006249e480 3521963291 C Co:1:083:0 0 1 >
ffff88006249e480 3521963341 S Co:1:083:0 s 40 a0 1300 0000 0001 1 = 32
ffff88006249e480 3521963405 C Co:1:083:0 0 1 >
ffff88006249e480 3521963449 S Co:1:083:0 s 40 a0 1301 0000 0001 1 = 32
ffff88006249e480 3521963530 C Co:1:083:0 0 1 >
ffff88006249e480 3521963573 S Co:1:083:0 s 40 a0 1302 0000 0001 1 = 32
ffff88006249e480 3521963654 C Co:1:083:0 0 1 >
ffff88006249e480 3521963711 S Co:1:083:0 s 40 a0 112d 0000 0010 16 = c0e0c0f0 c083c082 c0d075d0 00c000c0
ffff88006249e480 3521963779 C Co:1:083:0 0 16 >
ffff88006249e480 3521963836 S Co:1:083:0 s 40 a0 113d 0000 0010 16 = 01c002c0 03c004c0 05c006c0 075391bf
ffff88006249e480 3521963904 C Co:1:083:0 0 16 >
ffff88006249e480 3521963961 S Co:1:083:0 s 40 a0 114d 0000 0010 16 = 90e65174 01f01213 09d007d0 06d005d0
ffff88006249e480 3521964030 C Co:1:083:0 0 16 >
ffff88006249e480 3521964087 S Co:1:083:0 s 40 a0 115d 0000 0010 16 = 04d003d0 02d001d0 00d0d0d0 82d083d0
ffff88006249e480 3521964155 C Co:1:083:0 0 16 >
ffff88006249e480 3521964201 S Co:1:083:0 s 40 a0 116d 0000 0004 4 = f0d0e032
ffff88006249e480 3521964280 C Co:1:083:0 0 4 >
ffff88006249e480 3521964323 S Co:1:083:0 s 40 a0 1303 0000 0001 1 = 32
ffff88006249e480 3521964405 C Co:1:083:0 0 1 >
ffff88006249e480 3521964449 S Co:1:083:0 s 40 a0 1304 0000 0001 1 = 32
ffff88006249e480 3521964530 C Co:1:083:0 0 1 >
ffff88006249e480 3521964574 S Co:1:083:0 s 40 a0 1305 0000 0001 1 = 32
ffff88006249e480 3521964656 C Co:1:083:0 0 1 >
ffff88006249e480 3521964700 S Co:1:083:0 s 40 a0 1306 0000 0001 1 = 32
ffff88006249e480 3521964780 C Co:1:083:0 0 1 >
ffff88006249e480 3521964825 S Co:1:083:0 s 40 a0 1307 0000 0001 1 = 32
ffff88006249e480 3521964905 C Co:1:083:0 0 1 >
ffff88006249e480 3521964951 S Co:1:083:0 s 40 a0 0c9f 0000 0002 2 = c104
ffff88006249e480 3521965030 C Co:1:083:0 0 2 >
ffff88006249e480 3521965087 S Co:1:083:0 s 40 a0 0f44 0000 0010 16 = 12127912 0036d200 00000090 e60b7403
ffff88006249e480 3521965155 C Co:1:083:0 0 16 >
ffff88006249e480 3521965213 S Co:1:083:0 s 40 a0 0f54 0000 0010 16 = f0000000 00000012 09cc90e6 1074a0f0
ffff88006249e480 3521965280 C Co:1:083:0 0 16 >
ffff88006249e480 3521965337 S Co:1:083:0 s 40 a0 0f64 0000 0010 16 = 90e65ee0 ffef4408 ff90e65e eff00000
ffff88006249e480 3521965406 C Co:1:083:0 0 16 >
ffff88006249e480 3521965463 S Co:1:083:0 s 40 a0 0f74 0000 0010 16 = 0090e68d 7440f090 e61074a0 f0000000
ffff88006249e480 3521965531 C Co:1:083:0 0 16 >
ffff88006249e480 3521965588 S Co:1:083:0 s 40 a0 0f84 0000 0010 16 = 120ad090 e668e0ff ef4403ff 90e668ef
ffff88006249e480 3521965655 C Co:1:083:0 0 16 >
ffff88006249e480 3521965713 S Co:1:083:0 s 40 a0 0f94 0000 0010 16 = f0000000 5391bf00 000090e6 517401f0
ffff88006249e480 3521965781 C Co:1:083:0 0 16 >
ffff88006249e480 3521965838 S Co:1:083:0 s 40 a0 0fa4 0000 0010 16 = 00000090 e6507401 f0000000 43e80422
ffff88006249e480 3521965905 C Co:1:083:0 0 16 >
ffff88006249e480 3521965963 S Co:1:083:0 s 40 a0 1235 0000 0010 16 = e5bb30e7 1230040f e5ac30e0 0a75bb02
ffff88006249e480 3521966030 C Co:1:083:0 0 16 >
ffff88006249e480 3521966081 S Co:1:083:0 s 40 a0 1245 0000 0008 8 = c2047f03 12000322
ffff88006249e480 3521966156 C Co:1:083:0 0 8 >
ffff88006249e480 3521966213 S Co:1:083:0 s 40 a0 0874 0000 0010 16 = 7b017ae7 79808b1a 8a1b891c ab1aaa1b
ffff88006249e480 3521966280 C Co:1:083:0 0 16 >
ffff88006249e480 3521966336 S Co:1:083:0 s 40 a0 0884 0000 000e 14 = a91c120d 58ff8f1d e51d6401 7034
ffff88006249e480 3521966405 C Co:1:083:0 0 14 >
ffff88006249e480 3521966463 S Co:1:083:0 s 40 a0 0892 0000 0010 16 = ab1aaa1b a91c7582 01758300 120d71ff
ffff88006249e480 3521966530 C Co:1:083:0 0 16 >
ffff88006249e480 3521966587 S Co:1:083:0 s 40 a0 08a2 0000 0010 16 = 8f1e759d e4759e00 90e67ce5 1ef090e6
ffff88006249e480 3521966655 C Co:1:083:0 0 16 >
ffff88006249e480 3521966713 S Co:1:083:0 s 40 a0 08b2 0000 0010 16 = 18e4f000 000090e6 1ae4f000 0000120a
ffff88006249e480 3521966781 C Co:1:083:0 0 16 >
ffff88006249e480 3521966827 S Co:1:083:0 s 40 a0 08c2 0000 0004 4 = d075bb04
ffff88006249e480 3521966906 C Co:1:083:0 0 4 >
ffff88006249e480 3521966963 S Co:1:083:0 s 40 a0 08c6 0000 0010 16 = e51db402 0690e6f5 74fff0e5 1d640370
ffff88006249e480 3521967030 C Co:1:083:0 0 16 >
ffff88006249e480 3521967074 S Co:1:083:0 s 40 a0 08d6 0000 0001 1 = 33
ffff88006249e480 3521967155 C Co:1:083:0 0 1 >
ffff88006249e480 3521967213 S Co:1:083:0 s 40 a0 08d7 0000 0010 16 = ab1aaa1b a91c7582 01758300 120d71ff
ffff88006249e480 3521967294 C Co:1:083:0 0 16 >
ffff88006249e480 3521967358 S Co:1:083:0 s 40 a0 08e7 0000 0010 16 = 8f1e759d e4759e00 90e67ce5 1ef090e6
ffff88006249e480 3521967406 C Co:1:083:0 0 16 >
ffff88006249e480 3521967463 S Co:1:083:0 s 40 a0 08f7 0000 0010 16 = 18e4f000 000090e6 1ae4f000 0000120a
ffff88006249e480 3521967531 C Co:1:083:0 0 16 >
ffff88006249e480 3521967577 S Co:1:083:0 s 40 a0 0907 0000 0003 3 = d0d204
ffff88006249e480 3521967655 C Co:1:083:0 0 3 >
ffff88006249e480 3521967703 S Co:1:083:0 s 40 a0 090a 0000 0005 5 = e51db404 2b
ffff88006249e480 3521967780 C Co:1:083:0 0 5 >
ffff88006249e480 3521967838 S Co:1:083:0 s 40 a0 090f 0000 0010 16 = ab1aaa1b a91c7582 01758300 120d71ff
ffff88006249e480 3521967905 C Co:1:083:0 0 16 >
ffff88006249e480 3521967963 S Co:1:083:0 s 40 a0 091f 0000 0010 16 = 8f1e90e6 01e0ffef 54fcff90 e601eff0
ffff88006249e480 3521968030 C Co:1:083:0 0 16 >
ffff88006249e480 3521968084 S Co:1:083:0 s 40 a0 092f 0000 000b 11 = 75b3ff85 1e90af1e 120003
ffff88006249e480 3521968156 C Co:1:083:0 0 11 >
ffff88006249e480 3521968213 S Co:1:083:0 s 40 a0 093a 0000 0010 16 = e51db405 1275b300 90e7c0e5 90f00000
ffff88006249e480 3521968281 C Co:1:083:0 0 16 >
ffff88006249e480 3521968338 S Co:1:083:0 s 40 a0 094a 0000 0010 16 = 0090e68f 7401f0e5 1db40612 7b017ae7
ffff88006249e480 3521968405 C Co:1:083:0 0 16 >
ffff88006249e480 3521968462 S Co:1:083:0 s 40 a0 095a 0000 0010 16 = 79c01207 09000000 90e68f74 04f0e51d
ffff88006249e480 3521968532 C Co:1:083:0 0 16 >
ffff88006249e480 3521968589 S Co:1:083:0 s 40 a0 096a 0000 0010 16 = 64077054 ab1aaa1b a91c7582 01758300
ffff88006249e480 3521968655 C Co:1:083:0 0 16 >
ffff88006249e480 3521968713 S Co:1:083:0 s 40 a0 097a 0000 0010 16 = 120d71ff 7d08120b d2ab1aaa 1ba91c75
ffff88006249e480 3521968781 C Co:1:083:0 0 16 >
ffff88006249e480 3521968838 S Co:1:083:0 s 40 a0 098a 0000 0010 16 = 82027583 00120d71 ff7d0912 0bd2ab1a
ffff88006249e480 3521968905 C Co:1:083:0 0 16 >
ffff88006249e480 3521968962 S Co:1:083:0 s 40 a0 099a 0000 0010 16 = aa1ba91c 75820375 8300120d 71ff7d0a
ffff88006249e480 3521969030 C Co:1:083:0 0 16 >
ffff88006249e480 3521969088 S Co:1:083:0 s 40 a0 09aa 0000 0010 16 = 120bd2ab 1aaa1ba9 1c758204 75830012
ffff88006249e480 3521969156 C Co:1:083:0 0 16 >
ffff88006249e480 3521969213 S Co:1:083:0 s 40 a0 09ba 0000 0010 16 = 0d71ff7d 0b120bd2 00000090 e68d7440
ffff88006249e480 3521969280 C Co:1:083:0 0 16 >
ffff88006249e480 3521969325 S Co:1:083:0 s 40 a0 09ca 0000 0001 1 = f0
ffff88006249e480 3521969406 C Co:1:083:0 0 1 >
ffff88006249e480 3521969450 S Co:1:083:0 s 40 a0 09cb 0000 0001 1 = 22
ffff88006249e480 3521969531 C Co:1:083:0 0 1 >
ffff88006249e480 3521969589 S Co:1:083:0 s 40 a0 0ad0 0000 0010 16 = 90e601e0 ffef4402 ff90e601 eff090e6
ffff88006249e480 3521969656 C Co:1:083:0 0 16 >
ffff88006249e480 3521969713 S Co:1:083:0 s 40 a0 0ae0 0000 0010 16 = 1274e0f0 00000090 e61474a0 f0000000
ffff88006249e480 3521969780 C Co:1:083:0 0 16 >
ffff88006249e480 3521969837 S Co:1:083:0 s 40 a0 0af0 0000 0010 16 = 90e613e0 ffef547f ff90e613 eff00000
ffff88006249e480 3521969906 C Co:1:083:0 0 16 >
ffff88006249e480 3521969964 S Co:1:083:0 s 40 a0 0b00 0000 0010 16 = 0090e615 e0ffef54 7fff90e6 15eff000
ffff88006249e480 3521970031 C Co:1:083:0 0 16 >
ffff88006249e480 3521970088 S Co:1:083:0 s 40 a0 0b10 0000 0010 16 = 000090e6 047480f0 00000090 e6047402
ffff88006249e480 3521970156 C Co:1:083:0 0 16 >
ffff88006249e480 3521970215 S Co:1:083:0 s 40 a0 0b20 0000 0010 16 = f0000000 90e60474 04f00000 0090e604
ffff88006249e480 3521970280 C Co:1:083:0 0 16 >
ffff88006249e480 3521970338 S Co:1:083:0 s 40 a0 0b30 0000 0010 16 = 7406f000 000090e6 047408f0 00000090
ffff88006249e480 3521970406 C Co:1:083:0 0 16 >
ffff88006249e480 3521970464 S Co:1:083:0 s 40 a0 0b40 0000 0010 16 = e604e4f0 00000090 e6187408 f0000000
ffff88006249e480 3521970531 C Co:1:083:0 0 16 >
ffff88006249e480 3521970588 S Co:1:083:0 s 40 a0 0b50 0000 0010 16 = 90e6d374 01f00000 0090e6d2 7402f000
ffff88006249e480 3521970656 C Co:1:083:0 0 16 >
ffff88006249e480 3521970714 S Co:1:083:0 s 40 a0 0b60 0000 0010 16 = 000090e6 80e0ffef 20e71390 e620e4f0
ffff88006249e480 3521970781 C Co:1:083:0 0 16 >
ffff88006249e480 3521970839 S Co:1:083:0 s 40 a0 0b70 0000 0010 16 = 00000090 e6217440 f0000000 801190e6
ffff88006249e480 3521970907 C Co:1:083:0 0 16 >
ffff88006249e480 3521970964 S Co:1:083:0 s 40 a0 0b80 0000 0010 16 = 207402f0 00000090 e621e4f0 00000000
ffff88006249e480 3521971031 C Co:1:083:0 0 16 >
ffff88006249e480 3521971088 S Co:1:083:0 s 40 a0 0b90 0000 0010 16 = 000090e6 497486f0 00000090 e6497486
ffff88006249e480 3521971156 C Co:1:083:0 0 16 >
ffff88006249e480 3521971214 S Co:1:083:0 s 40 a0 0ba0 0000 0010 16 = f0000000 90e64974 86f00000 0090e649
ffff88006249e480 3521971282 C Co:1:083:0 0 16 >
ffff88006249e480 3521971357 S Co:1:083:0 s 40 a0 0bb0 0000 0010 16 = 7486f000 000090e6 1a7410f0 00000090
ffff88006249e480 3521971406 C Co:1:083:0 0 16 >
ffff88006249e480 3521971464 S Co:1:083:0 s 40 a0 0bc0 0000 0010 16 = e6e37401 f0000000 90e6e274 01f00000
ffff88006249e480 3521971531 C Co:1:083:0 0 16 >
ffff88006249e480 3521971576 S Co:1:083:0 s 40 a0 0bd0 0000 0002 2 = 0022
ffff88006249e480 3521971656 C Co:1:083:0 0 2 >
ffff88006249e480 3521971700 S Co:1:083:0 s 40 a0 1308 0000 0001 1 = 22
ffff88006249e480 3521971781 C Co:1:083:0 0 1 >
ffff88006249e480 3521971825 S Co:1:083:0 s 40 a0 1309 0000 0001 1 = 22
ffff88006249e480 3521971906 C Co:1:083:0 0 1 >
ffff88006249e480 3521971951 S Co:1:083:0 s 40 a0 12e6 0000 0002 2 = d322
ffff88006249e480 3521972032 C Co:1:083:0 0 2 >
ffff88006249e480 3521972077 S Co:1:083:0 s 40 a0 12e8 0000 0002 2 = c322
ffff88006249e480 3521972156 C Co:1:083:0 0 2 >
ffff88006249e480 3521972214 S Co:1:083:0 s 40 a0 0bd2 0000 0010 16 = 8f3d8d3e 90e678e0 ffef4480 ff90e678
ffff88006249e480 3521972281 C Co:1:083:0 0 16 >
ffff88006249e480 3521972339 S Co:1:083:0 s 40 a0 0be2 0000 0010 16 = eff090e6 7974a0f0 90e678e0 ffef30e0
ffff88006249e480 3521972406 C Co:1:083:0 0 16 >
ffff88006249e480 3521972463 S Co:1:083:0 s 40 a0 0bf2 0000 0010 16 = f790e678 e0ffef20 e11b90e6 78e0ffef
ffff88006249e480 3521972532 C Co:1:083:0 0 16 >
ffff88006249e480 3521972589 S Co:1:083:0 s 40 a0 0c02 0000 0010 16 = 4440ff90 e678eff0 90e678e0 ffef30e6
ffff88006249e480 3521972657 C Co:1:083:0 0 16 >
ffff88006249e480 3521972714 S Co:1:083:0 s 40 a0 0c12 0000 0010 16 = c380f580 bf90e679 e53ef090 e678e0ff
ffff88006249e480 3521972781 C Co:1:083:0 0 16 >
ffff88006249e480 3521972838 S Co:1:083:0 s 40 a0 0c22 0000 0010 16 = ef30e0f7 90e678e0 ffef20e1 1b90e678
ffff88006249e480 3521972906 C Co:1:083:0 0 16 >
ffff88006249e480 3521972963 S Co:1:083:0 s 40 a0 0c32 0000 0010 16 = e0ffef44 40ff90e6 78eff090 e678e0ff
ffff88006249e480 3521973032 C Co:1:083:0 0 16 >
ffff88006249e480 3521973088 S Co:1:083:0 s 40 a0 0c42 0000 0010 16 = ef30e690 80f5808c 90e679e5 3df090e6
ffff88006249e480 3521973155 C Co:1:083:0 0 16 >
ffff88006249e480 3521973213 S Co:1:083:0 s 40 a0 0c52 0000 0010 16 = 78e0ffef 30e0f790 e678e0ff ef20e11f
ffff88006249e480 3521973282 C Co:1:083:0 0 16 >
ffff88006249e480 3521973339 S Co:1:083:0 s 40 a0 0c62 0000 0010 16 = 90e678e0 ffef4440 ff90e678 eff090e6
ffff88006249e480 3521973406 C Co:1:083:0 0 16 >
ffff88006249e480 3521973463 S Co:1:083:0 s 40 a0 0c72 0000 0010 16 = 78e0ffef 20e60302 0bd680f2 020bd690
ffff88006249e480 3521973531 C Co:1:083:0 0 16 >
ffff88006249e480 3521973588 S Co:1:083:0 s 40 a0 0c82 0000 0010 16 = e678e0ff ef4440ff 90e678ef f090e678
ffff88006249e480 3521973656 C Co:1:083:0 0 16 >
ffff88006249e480 3521973711 S Co:1:083:0 s 40 a0 0c92 0000 000d 13 = e0ffef30 e60680f5 22020bd6 22
ffff88006249e480 3521973782 C Co:1:083:0 0 13 >
ffff88006249e480 3521973831 S Co:1:083:0 s 40 a0 0709 0000 0006 6 = 8b2f8a30 8931
ffff88006249e480 3521973907 C Co:1:083:0 0 6 >
ffff88006249e480 3521973964 S Co:1:083:0 s 40 a0 070f 0000 0010 16 = ab2faa30 a9318b33 8a348935 90e678e0
ffff88006249e480 3521974031 C Co:1:083:0 0 16 >
ffff88006249e480 3521974088 S Co:1:083:0 s 40 a0 071f 0000 0010 16 = ffef4480 ff90e678 eff090e6 7974a0f0
ffff88006249e480 3521974157 C Co:1:083:0 0 16 >
ffff88006249e480 3521974214 S Co:1:083:0 s 40 a0 072f 0000 0010 16 = 90e678e0 ffef30e0 f790e678 e0ffef20
ffff88006249e480 3521974282 C Co:1:083:0 0 16 >
ffff88006249e480 3521974340 S Co:1:083:0 s 40 a0 073f 0000 0010 16 = e11b90e6 78e0ffef 4440ff90 e678eff0
ffff88006249e480 3521974407 C Co:1:083:0 0 16 >
ffff88006249e480 3521974464 S Co:1:083:0 s 40 a0 074f 0000 0010 16 = 90e678e0 ffef30e6 b780f580 b390e679
ffff88006249e480 3521974531 C Co:1:083:0 0 16 >
ffff88006249e480 3521974599 S Co:1:083:0 s 40 a0 075f 0000 0010 16 = 7408f090 e678e0ff ef30e0f7 90e678e0
ffff88006249e480 3521974657 C Co:1:083:0 0 16 >
ffff88006249e480 3521974716 S Co:1:083:0 s 40 a0 076f 0000 0010 16 = ffef20e1 1b90e678 e0ffef44 40ff90e6
ffff88006249e480 3521974782 C Co:1:083:0 0 16 >
ffff88006249e480 3521974840 S Co:1:083:0 s 40 a0 077f 0000 0010 16 = 78eff090 e678e0ff ef30e684 80f58080
ffff88006249e480 3521974906 C Co:1:083:0 0 16 >
ffff88006249e480 3521974963 S Co:1:083:0 s 40 a0 078f 0000 0010 16 = 90e678e0 ffef4480 ff90e678 eff090e6
ffff88006249e480 3521975032 C Co:1:083:0 0 16 >
ffff88006249e480 3521975089 S Co:1:083:0 s 40 a0 079f 0000 0010 16 = 7974a1f0 90e678e0 ffef30e0 f790e678
ffff88006249e480 3521975157 C Co:1:083:0 0 16 >
ffff88006249e480 3521975214 S Co:1:083:0 s 40 a0 07af 0000 0010 16 = e0ffef20 e11f90e6 78e0ffef 4440ff90
ffff88006249e480 3521975283 C Co:1:083:0 0 16 >
ffff88006249e480 3521975357 S Co:1:083:0 s 40 a0 07bf 0000 0010 16 = e678eff0 90e678e0 ffef20e6 0302070f
ffff88006249e480 3521975407 C Co:1:083:0 0 16 >
ffff88006249e480 3521975465 S Co:1:083:0 s 40 a0 07cf 0000 0010 16 = 80f20207 0f90e679 e0ff8f32 90e678e0
ffff88006249e480 3521975531 C Co:1:083:0 0 16 >
ffff88006249e480 3521975588 S Co:1:083:0 s 40 a0 07df 0000 0010 16 = ffef30e0 f7753200 e532c394 045068e5
ffff88006249e480 3521975657 C Co:1:083:0 0 16 >
ffff88006249e480 3521975714 S Co:1:083:0 s 40 a0 07ef 0000 0010 16 = 32b4030e 90e678e0 ffef4420 ff90e678
ffff88006249e480 3521975782 C Co:1:083:0 0 16 >
ffff88006249e480 3521975839 S Co:1:083:0 s 40 a0 07ff 0000 0010 16 = eff090e6 79e0ffab 33aa34a9 35ef120d
ffff88006249e480 3521975906 C Co:1:083:0 0 16 >
ffff88006249e480 3521975964 S Co:1:083:0 s 40 a0 080f 0000 0010 16 = 9e740125 35f535e4 3534f534 90e678e0
ffff88006249e480 3521976032 C Co:1:083:0 0 16 >
ffff88006249e480 3521976089 S Co:1:083:0 s 40 a0 081f 0000 0010 16 = ffef30e0 f790e678 e0ffef20 e125e532
ffff88006249e480 3521976157 C Co:1:083:0 0 16 >
ffff88006249e480 3521976214 S Co:1:083:0 s 40 a0 082f 0000 0010 16 = 6403601f 90e678e0 ffef4440 ff90e678
ffff88006249e480 3521976282 C Co:1:083:0 0 16 >
ffff88006249e480 3521976340 S Co:1:083:0 s 40 a0 083f 0000 0010 16 = eff090e6 78e0ffef 20e60302 070f80f2
ffff88006249e480 3521976407 C Co:1:083:0 0 16 >
ffff88006249e480 3521976464 S Co:1:083:0 s 40 a0 084f 0000 0010 16 = 02070f05 32809190 e678e0ff ef4440ff
ffff88006249e480 3521976532 C Co:1:083:0 0 16 >
ffff88006249e480 3521976589 S Co:1:083:0 s 40 a0 085f 0000 0010 16 = 90e678ef f090e678 e0ffef30 e60680f5
ffff88006249e480 3521976656 C Co:1:083:0 0 16 >
ffff88006249e480 3521976703 S Co:1:083:0 s 40 a0 086f 0000 0004 4 = 2202070f
ffff88006249e480 3521976783 C Co:1:083:0 0 4 >
ffff88006249e480 3521976826 S Co:1:083:0 s 40 a0 0873 0000 0001 1 = 22
ffff88006249e480 3521976907 C Co:1:083:0 0 1 >
ffff88006249e480 3521976964 S Co:1:083:0 s 40 a0 0ca1 0000 0010 16 = 60801770 01380101 01010107 06010000
ffff88006249e480 3521977031 C Co:1:083:0 0 16 >
ffff88006249e480 3521977089 S Co:1:083:0 s 40 a0 0cb1 0000 0010 16 = 00000000 00000000 00000000 00360000
ffff88006249e480 3521977157 C Co:1:083:0 0 16 >
ffff88006249e480 3521977215 S Co:1:083:0 s 40 a0 0cc1 0000 0010 16 = 0000003f 01b90101 01010107 02070202
ffff88006249e480 3521977282 C Co:1:083:0 0 16 >
ffff88006249e480 3521977339 S Co:1:083:0 s 40 a0 0cd1 0000 0010 16 = 02020200 00000000 00000000 00360000
ffff88006249e480 3521977407 C Co:1:083:0 0 16 >
ffff88006249e480 3521977466 S Co:1:083:0 s 40 a0 0ce1 0000 0010 16 = 0000003f 01010101 01010107 00000000
ffff88006249e480 3521977532 C Co:1:083:0 0 16 >
ffff88006249e480 3521977590 S Co:1:083:0 s 40 a0 0cf1 0000 0010 16 = 00000000 00000000 00000000 00000000
ffff88006249e480 3521977656 C Co:1:083:0 0 16 >
ffff88006249e480 3521977713 S Co:1:083:0 s 40 a0 0d01 0000 0010 16 = 0000003f 01010101 01010107 00000000
ffff88006249e480 3521977783 C Co:1:083:0 0 16 >
ffff88006249e480 3521977840 S Co:1:083:0 s 40 a0 0d11 0000 0010 16 = 00000000 00000000 00000000 00000000
ffff88006249e480 3521977906 C Co:1:083:0 0 16 >
ffff88006249e480 3521977965 S Co:1:083:0 s 40 a0 0d21 0000 0010 16 = 0000003f 602417f7 00000000 00000000
ffff88006249e480 3521978032 C Co:1:083:0 0 16 >
ffff88006249e480 3521978089 S Co:1:083:0 s 40 a0 0d31 0000 0010 16 = 00000000 00000000 00000000 00000000
ffff88006249e480 3521978156 C Co:1:083:0 0 16 >
ffff88006249e480 3521978213 S Co:1:083:0 s 40 a0 0d41 0000 0010 16 = 00000000 00000000 00000000 4717f0e0
ffff88006249e480 3521978284 C Co:1:083:0 0 16 >
ffff88006249e480 3521978334 S Co:1:083:0 s 40 a0 0d51 0000 0006 6 = 000000ce 5000
ffff88006249e480 3521978408 C Co:1:083:0 0 6 >
ffff88006249e480 3521978466 S Co:1:083:0 s 40 a0 09cc 0000 0010 16 = 90e60174 cef090e6 f574fff0 9017f0e0
ffff88006249e480 3521978531 C Co:1:083:0 0 16 >
ffff88006249e480 3521978588 S Co:1:083:0 s 40 a0 09dc 0000 0010 16 = ff90e6f3 eff09017 f1e0ff90 e6c3eff0
ffff88006249e480 3521978657 C Co:1:083:0 0 16 >
ffff88006249e480 3521978714 S Co:1:083:0 s 40 a0 09ec 0000 0010 16 = 9017f2e0 ff90e6c1 eff09017 f3e0ff90
ffff88006249e480 3521978783 C Co:1:083:0 0 16 >
ffff88006249e480 3521978839 S Co:1:083:0 s 40 a0 09fc 0000 0010 16 = e6c2eff0 9017f5e0 ff90e6c0 eff09017
ffff88006249e480 3521978907 C Co:1:083:0 0 16 >
ffff88006249e480 3521978964 S Co:1:083:0 s 40 a0 0a0c 0000 0010 16 = f6e0ff90 e6f4eff0 75af077b 017a1779
ffff88006249e480 3521979031 C Co:1:083:0 0 16 >
ffff88006249e480 3521979089 S Co:1:083:0 s 40 a0 0a1c 0000 0010 16 = 70ae02af 01eeff7e 00ef54ff f59a7b01
ffff88006249e480 3521979158 C Co:1:083:0 0 16 >
ffff88006249e480 3521979215 S Co:1:083:0 s 40 a0 0a2c 0000 0010 16 = 7a177970 af01ef54 fff59b75 9de4759e
ffff88006249e480 3521979283 C Co:1:083:0 0 16 >
ffff88006249e480 3521979358 S Co:1:083:0 s 40 a0 0a3c 0000 0010 16 = 00751f00 e51fc394 80500e90 e67be0ff
ffff88006249e480 3521979407 C Co:1:083:0 0 16 >
ffff88006249e480 3521979464 S Co:1:083:0 s 40 a0 0a4c 0000 0010 16 = 90e67cef f0051f80 eb90e671 74fff075
ffff88006249e480 3521979532 C Co:1:083:0 0 16 >
ffff88006249e480 3521979589 S Co:1:083:0 s 40 a0 0a5c 0000 0010 16 = b4ff90e6 72e0ffef 4480ff90 e672eff0
ffff88006249e480 3521979657 C Co:1:083:0 0 16 >
ffff88006249e480 3521979714 S Co:1:083:0 s 40 a0 0a6c 0000 0010 16 = 43b68000 000090e6 c4e4f000 000090e6
ffff88006249e480 3521979778 C Co:1:083:0 0 16 >
ffff88006249e480 3521980227 S Co:1:083:0 s 40 a0 0a7c 0000 0010 16 = c5e4f090 17f7e0ff 90e6c6ef f09017f8
ffff88006249e480 3521980283 C Co:1:083:0 0 16 >
ffff88006249e480 3521980341 S Co:1:083:0 s 40 a0 0a8c 0000 0010 16 = e0ff90e6 c7eff090 17f9e0ff 90e6c8ef
ffff88006249e480 3521980407 C Co:1:083:0 0 16 >
ffff88006249e480 3521980463 S Co:1:083:0 s 40 a0 0a9c 0000 0010 16 = f09017fa e0ff90e6 c9eff090 17fbe0ff
ffff88006249e480 3521980532 C Co:1:083:0 0 16 >
ffff88006249e480 3521980589 S Co:1:083:0 s 40 a0 0aac 0000 0010 16 = 90e6caef f09017fc e0ff90e6 cbeff090
ffff88006249e480 3521980658 C Co:1:083:0 0 16 >
ffff88006249e480 3521980715 S Co:1:083:0 s 40 a0 0abc 0000 0010 16 = 17fde0ff 90e6ccef f09017fe e0ff90e6
ffff88006249e480 3521980783 C Co:1:083:0 0 16 >
ffff88006249e480 3521980829 S Co:1:083:0 s 40 a0 0acc 0000 0003 3 = cdeff0
ffff88006249e480 3521980908 C Co:1:083:0 0 3 >
ffff88006249e480 3521980951 S Co:1:083:0 s 40 a0 0acf 0000 0001 1 = 22
ffff88006249e480 3521981033 C Co:1:083:0 0 1 >
ffff88006249e480 3521981078 S Co:1:083:0 s 40 a0 0000 0000 0003 3 = 020eb8
ffff88006249e480 3521981158 C Co:1:083:0 0 3 >
ffff88006249e480 3521981211 S Co:1:083:0 s 40 a0 0eb8 0000 000c 12 = 787fe4f6 d8fd7581 40020eff
ffff88006249e480 3521981281 C Co:1:083:0 0 12 >
ffff88006249e480 3521981339 S Co:1:083:0 s 40 a0 0d58 0000 0010 16 = bb010689 828a83e0 225002e7 22bbfe02
ffff88006249e480 3521981407 C Co:1:083:0 0 16 >
ffff88006249e480 3521981458 S Co:1:083:0 s 40 a0 0d68 0000 0009 9 = e3228982 8a83e493 22
ffff88006249e480 3521981532 C Co:1:083:0 0 9 >
ffff88006249e480 3521981589 S Co:1:083:0 s 40 a0 0d71 0000 0010 16 = bb010ce5 8229f582 e5833af5 83e02250
ffff88006249e480 3521981658 C Co:1:083:0 0 16 >
ffff88006249e480 3521981714 S Co:1:083:0 s 40 a0 0d81 0000 0010 16 = 06e92582 f8e622bb fe06e925 82f8e222
ffff88006249e480 3521981781 C Co:1:083:0 0 16 >
ffff88006249e480 3521981837 S Co:1:083:0 s 40 a0 0d91 0000 000d 13 = e58229f5 82e5833a f583e493 22
ffff88006249e480 3521981908 C Co:1:083:0 0 13 >
ffff88006249e480 3521981964 S Co:1:083:0 s 40 a0 0d9e 0000 0010 16 = bb010689 828a83f0 225002f7 22bbfe01
ffff88006249e480 3521982032 C Co:1:083:0 0 16 >
ffff88006249e480 3521982076 S Co:1:083:0 s 40 a0 0dae 0000 0002 2 = f322
ffff88006249e480 3521982157 C Co:1:083:0 0 2 >
ffff88006249e480 3521982214 S Co:1:083:0 s 40 a0 0db0 0000 0010 16 = eb9ff5f0 ea9e42f0 e99d42f0 e89c45f0
ffff88006249e480 3521982284 C Co:1:083:0 0 16 >
ffff88006249e480 3521982331 S Co:1:083:0 s 40 a0 0dc0 0000 0001 1 = 22
ffff88006249e480 3521982408 C Co:1:083:0 0 1 >
ffff88006249e480 3521982466 S Co:1:083:0 s 40 a0 0dc1 0000 0010 16 = d083d082 f8e49370 12740193 700da3a3
ffff88006249e480 3521982532 C Co:1:083:0 0 16 >
ffff88006249e480 3521982590 S Co:1:083:0 s 40 a0 0dd1 0000 0010 16 = 93f87401 93f58288 83e47374 02936860
ffff88006249e480 3521982658 C Co:1:083:0 0 16 >
ffff88006249e480 3521982707 S Co:1:083:0 s 40 a0 0de1 0000 0006 6 = efa3a3a3 80df
ffff88006249e480 3521982783 C Co:1:083:0 0 6 >
ffff88006249e480 3521982841 S Co:1:083:0 s 40 a0 0ec4 0000 0010 16 = 02048ee4 93a3f8e4 93a34003 f68001f2
ffff88006249e480 3521982907 C Co:1:083:0 0 16 >
ffff88006249e480 3521982965 S Co:1:083:0 s 40 a0 0ed4 0000 0010 16 = 08dff480 29e493a3 f8540724 0cc8c333
ffff88006249e480 3521983033 C Co:1:083:0 0 16 >
ffff88006249e480 3521983091 S Co:1:083:0 s 40 a0 0ee4 0000 0010 16 = c4540f44 20c88340 04f45680 0146f6df
ffff88006249e480 3521983158 C Co:1:083:0 0 16 >
ffff88006249e480 3521983216 S Co:1:083:0 s 40 a0 0ef4 0000 0010 16 = e4800b01 02040810 20408090 0c9fe47e
ffff88006249e480 3521983296 C Co:1:083:0 0 16 >
ffff88006249e480 3521983362 S Co:1:083:0 s 40 a0 0f04 0000 0010 16 = 019360bc a3ff543f 30e50954 1ffee493
ffff88006249e480 3521983410 C Co:1:083:0 0 16 >
ffff88006249e480 3521983469 S Co:1:083:0 s 40 a0 0f14 0000 0010 16 = a360010e cf54c025 e060a840 b8e493a3
ffff88006249e480 3521983533 C Co:1:083:0 0 16 >
ffff88006249e480 3521983591 S Co:1:083:0 s 40 a0 0f24 0000 0010 16 = fae493a3 f8e493a3 c8c582c8 cac583ca
ffff88006249e480 3521983658 C Co:1:083:0 0 16 >
ffff88006249e480 3521983715 S Co:1:083:0 s 40 a0 0f34 0000 0010 16 = f0a3c8c5 82c8cac5 83cadfe9 dee780be
ffff88006249e480 3521983782 C Co:1:083:0 0 16 >
ffff88006249e480 3521983826 S Co:1:083:0 s 40 a0 0d57 0000 0001 1 = 00
ffff88006249e480 3521983907 C Co:1:083:0 0 1 >
ffff88006249e480 3521983951 S Co:1:083:0 s 40 a0 e680 0000 0001 1 = 00
ffff88006249e480 3521984033 C Co:1:083:0 0 1 >
ffff88006249e480 3521984066 S Co:1:083:0 s 40 a0 e600 0000 0001 1 = 00
ffff88006249e480 3521984156 C Co:1:083:0 0 1 >
ffff88007d70c6c0 3521986683 C Ii:1:001:1 0:2048 2 = 0800
ffff88007d70c6c0 3521986693 S Ii:1:001:1 -115:2048 4 <
ffff88006249e480 3521986733 S Ci:1:001:0 s a3 00 0000 0003 0004 4 <
ffff88006249e480 3521986758 C Ci:1:001:0 0 4 = 00010100
ffff88006249e480 3521986779 S Co:1:001:0 s 23 01 0010 0003 0000 0
ffff88006249e480 3521986799 C Co:1:001:0 0 0
ffff88006249e480 3521988571 S Ci:1:001:0 s a3 00 0000 0003 0004 4 <
ffff88006249e480 3521988605 C Ci:1:001:0 0 4 = 00010000
ffff88004b8cf180 3522019311 S Ci:1:001:0 s a3 00 0000 0003 0004 4 <
ffff88004b8cf180 3522019370 C Ci:1:001:0 0 4 = 00010000
ffff88004b8cf180 3522051301 S Ci:1:001:0 s a3 00 0000 0003 0004 4 <
ffff88004b8cf180 3522051329 C Ci:1:001:0 0 4 = 00010000
ffff88004b8cf180 3522083298 S Ci:1:001:0 s a3 00 0000 0003 0004 4 <
ffff88004b8cf180 3522083321 C Ci:1:001:0 0 4 = 00010000
ffff88005b49d9c0 3522115301 S Ci:1:001:0 s a3 00 0000 0003 0004 4 <
ffff88005b49d9c0 3522115331 C Ci:1:001:0 0 4 = 00010000
ffff88007d70c6c0 3523501479 C Ii:1:001:1 0:2048 2 = 0800
ffff88007d70c6c0 3523501493 S Ii:1:001:1 -115:2048 4 <
ffff8800691fe900 3523501689 S Ci:1:001:0 s a3 00 0000 0003 0004 4 <
ffff8800691fe900 3523501758 C Ci:1:001:0 0 4 = 01050100
ffff8800691fe900 3523501820 S Co:1:001:0 s 23 01 0010 0003 0000 0
ffff8800691fe900 3523501879 C Co:1:001:0 0 0
ffff8800691fe900 3523501934 S Ci:1:001:0 s a3 00 0000 0003 0004 4 <
ffff8800691fe900 3523501989 C Ci:1:001:0 0 4 = 01050000
ffff8800691fe900 3523530315 S Ci:1:001:0 s a3 00 0000 0003 0004 4 <
ffff8800691fe900 3523530801 C Ci:1:001:0 0 4 = 01050000
ffff88005b505600 3523563360 S Ci:1:001:0 s a3 00 0000 0003 0004 4 <
ffff88005b505600 3523564036 C Ci:1:001:0 0 4 = 01050000
ffff8800624daa80 3523595952 S Ci:1:001:0 s a3 00 0000 0003 0004 4 <
ffff8800624daa80 3523596654 C Ci:1:001:0 0 4 = 01050000
ffff8800691a3d80 3523627311 S Ci:1:001:0 s a3 00 0000 0003 0004 4 <
ffff8800691a3d80 3523627845 C Ci:1:001:0 0 4 = 01050000
ffff8800691a3d80 3523628097 S Co:1:001:0 s 23 03 0004 0003 0000 0
ffff8800691a3d80 3523628166 C Co:1:001:0 0 0
ffff8800691a3d80 3523683308 S Ci:1:001:0 s a3 00 0000 0003 0004 4 <
ffff8800691a3d80 3523683657 C Ci:1:001:0 0 4 = 03051000
ffff8800691a3d80 3523738312 S Co:1:001:0 s 23 01 0014 0003 0000 0
ffff8800691a3d80 3523738657 C Co:1:001:0 0 0
ffff8800691a3d80 3523738891 S Ci:1:000:0 s 80 06 0100 0000 0040 64 <
ffff8800691a3d80 3523739022 C Ci:1:000:0 0 18 = 12010002 ffffff40 25098138 00000102 0001
ffff8800691a3d80 3523739124 S Co:1:001:0 s 23 03 0004 0003 0000 0
ffff8800691a3d80 3523739183 C Co:1:001:0 0 0
ffff8800691a3d80 3523794319 S Ci:1:001:0 s a3 00 0000 0003 0004 4 <
ffff8800691a3d80 3523794706 C Ci:1:001:0 0 4 = 03051000
ffff8800691a3d80 3523850317 S Co:1:001:0 s 23 01 0014 0003 0000 0
ffff8800691a3d80 3523850697 C Co:1:001:0 0 0
ffff8800691a3d80 3523850920 S Co:1:000:0 s 00 05 0054 0000 0000 0
ffff8800691a3d80 3523851035 C Co:1:000:0 0 0
ffff8800691a3d80 3523871303 S Ci:1:084:0 s 80 06 0100 0000 0012 18 <
ffff8800691a3d80 3523871408 C Ci:1:084:0 0 18 = 12010002 ffffff40 25098138 00000102 0001
ffff8800691a3d80 3523871651 S Ci:1:084:0 s 80 06 0200 0000 0009 9 <
ffff8800691a3d80 3523871786 C Ci:1:084:0 0 9 = 09022e00 01010080 32
ffff8800691a3d80 3523871855 S Ci:1:084:0 s 80 06 0200 0000 002e 46 <
ffff8800691a3d80 3523872035 C Ci:1:084:0 0 46 = 09022e00 01010080 32090400 0004ffff ff000705 01020002 00070581 02000200
ffff8800691a3d80 3523872125 S Ci:1:084:0 s 80 06 0300 0000 00ff 255 <
ffff8800691a3d80 3523872285 C Ci:1:084:0 0 4 = 04030904
ffff8800691a3d80 3523872444 S Ci:1:084:0 s 80 06 0302 0409 00ff 255 <
ffff8800691a3d80 3523872661 C Ci:1:084:0 0 12 = 0c034c00 6f006700 69006300
ffff8800691a3d80 3523872732 S Ci:1:084:0 s 80 06 0301 0409 00ff 255 <
ffff8800691a3d80 3523872910 C Ci:1:084:0 0 22 = 16035300 61006c00 65006100 65002000 4c004c00 4300
ffff88004f09aa80 3523885166 S Co:1:084:0 s 00 09 0001 0000 0000 0
ffff88004f09aa80 3523885290 C Co:1:084:0 0 0
ffff88005b5fd540 3523988111 S Bo:1:084:1 -115 1 = 06
ffff88005b5fd540 3523988177 C Bo:1:084:1 0 1 >
ffff88005b5fd540 3523988982 S Bi:1:084:1 -115 4 <
ffff88005b5fd540 3523989172 C Bi:1:084:1 0 4 = f1088d90
ffff88007d71e600 3528919750 C Ii:6:001:1 -2:128 0
ffff88007d71e480 3528919781 C Ii:5:001:1 -2:128 0
ffff88007d71e300 3528919793 C Ii:4:001:1 -2:128 0
ffff88007d70cf00 3528919804 C Ii:3:001:1 -2:128 0
ffff88007d70cb40 3528919816 C Ii:2:001:1 -2:128 0
